repository	accession_primary	gse	gpl	organism	n_samples	priority	title	summary	query
GEO (GDS)	GSE2109	GSE2109	GPL570	Homo sapiens	2158	low	Expression Project for Oncology (expO)	The mission of expO is to build on the technologies and outcomes of the Human Genome Project to accelerate improved clinical management of cancer patients. IGC's Expression Project for Oncology (expO) seeks to integrate longitudinal clinical annotation with gene expression data for a unique and powerful portrait of human malignancies, providing critical perspective on diagnostic markers, prognostic indicators, and therapeutic targets. The goal of expO and its consortium supporters is to procure tissue samples under standard conditions and perform gene expression analyses on a clinically annotated set of deidentified tumor samples. The tumor data is updated with clinical outcomes and is released into the public domain without intellectual property restriction. Series-matrices are available at ftp://ftp.ncbi.nlm.nih.gov/pub/geo/DATA/SeriesMatrix/GSE2109/. For more information, see http://www.intgen.org/ Keywords: cancer portraits	ovariectomy adipose gene expression
GEO (GDS)	GSE141221	GSE141221	GPL16791	Homo sapiens	1196	low	Adipose tissue network analyses reveal negative association between GDF15 and BMI during weight management intervention.	CONTEXT: Adipose tissue (AT) transcriptome studies provide holistic pictures of adaptation to weight and related bioclinical settings changes. OBJECTIVE: To implement AT gene expression profiling and investigate the link between changes in bioclinical parameters and AT gene expression during three steps of a two-phase dietary intervention (DI). RESULTS: During LCD, 5 modules were found, 3 of which including at least 1 bio-clinical variable. Especially, the change in BMI was connected to changes in mRNA level of genes with Inflammatory response signature. In this module, BMI was negatively connected to several genes encoding secreted proteins including GDF15, CCL3 and SPP1. Whatever the phase of the DI, change in GDF15 was connected to changes in SPP1, CCL3, LIPA and CD68. CONCLUSION: network analyses confirm GDF15 as upregulated with calorie restriction-induced weight loss, concomitantly to macrophages markers.	menopause adipose tissue expression profiling
GEO (GDS)	GSE273407	GSE273407	GPL24247	Mus musculus	58	low	Adipose stem cells are sexually dimorphic cells with dual roles as preadipocytes and resident fibroblasts [FACS_castovary_ASC]	Cell identities are defined by intrinsic transcriptional networks and spatio-temporal environmental factors. Here, we explored multiple factors that contribute to the identity of adipose stem cells, including anatomic location, microvascular neighborhood, and sex. Our data suggest that adipose stem cells serve a dual role as adipocyte precursors and fibroblast-like cells that shape the adipose tissue’s extracellular matrix in an organotypic manner. We further find that adipose stem cells display sexual dimorphism regarding genes involved in estrogen signaling, homebox transcription factor expression and the renin-angiotensin-aldosterone system. These differences could be attributed to sex hormone effects, developmental origin, or both. Finally, our data demonstrate that adipose stem cells are distinct from mural cells, and that the state of commitment to adipogenic differentiation is linked to their anatomic position in the microvascular niche. Our work supports the importance of sex and microvascular function in adipose tissue physiology.	ovariectomy adipose gene expression
GEO (GDS)	GSE84046	GSE84046	GPL11532	Homo sapiens	44	low	The impact of protein quantity during energy restriction on genome-wide gene expression analysis in human adipose tissue	Overweight is a growing health problem worldwide. The most effective strategy to reduce weight is energy restriction (ER): restriction of food intake without malnutrition. ER has been shown to be beneficial in disease prevention, healthy aging, and inflammation. Recent studies suggest that reducing the protein content of a diet contributes to the beneficial effects by ER. The first objective of our study was to assess the effect of energy restriction on changes in gene expression in adipose tissue. Secondly, the changes in gene expression were compared between a high protein diet and a normal protein diet during energy restriction. In a parallel double-blinded study, overweight older subjects adhered to a 25% ER diet, either combined with high protein intake (HP-ER, 1.7 g/kg per day), or with normal protein intake (NP-ER, 0.9 g/kg per day) for 12 weeks. From 10 HP-ER subjects and 12 NP-ER subjects subcutaneous adipose tissue biopsies were collected before and after the diet. Adipose tissue was used to isolate total RNA and to evaluate whole genome gene expression changes upon a HP-ER and NP-ER diet. Upon 25% ER, clusters of gene sets in energy metabolism, such as lipid metabolism and PPARα targets, NRF2 targets, glucose metabolism, and TCA cycle, as well as gene sets in oxidative phosphorylation, adaptive immune response, immune cell infiltration, and cell cycle were decreased, and RNA translation and processing gene sets were increased. A different gene expression response between HP-ER and NP-ER was observed for 530 genes. Pathway analysis revealed that after NP-ER a downregulation in expression of genes involved in adaptive immune response was present. HP-ER resulted in an upregulation of pathways involved in cell cycle, GPCR signalling, olfactory signalling and nitrogen metabolism. Based on the gene expression changes, we concluded that HP seems to be less beneficial for ER’s effect on immune-related gene expression in adipose tissue.	""postmenopausal"" ""subcutaneous adipose""
GEO (GDS)	GSE237950	GSE237950	GPL22396	Rattus norvegicus	22	low	Data of RNA-seq transcriptomes of gastrocnemius muscle and epididymal adipose tissue in obese rats changes in hypoxic exercise environments	With the economic development and the change of people's lifestyle, the incidence of obesity in China is increasing year by year, and obesity has become a major public health problem that endangers global health. At present, the average obesity rate in China is about 12%, and the total number of obesities ranks first in the world. Obesity is a metabolic disorder caused by excessive accumulation of white adipose tissue, which can further induce metabolic syndrome such as insulin resistance, type 2 diabetes, and cardiovascular and cerebrovascular diseases. Studies have shown that altitude hypoxic exercise can not only improve muscle buffering capacity and body performance, but also reduce body weight and body fat more significantly. In many countries, it has been used as a treatment program for obesity diseases. Hypoxic exercise can improve lipid metabolism, reduce blood lipid levels, inhibit fatty acid synthesis, and promote fatty acid decomposition and oxidation, which is the mechanism of hypoxic exercise to significantly reduce weight and fat. However, the mechanism of the cross-talk between muscle and fat tissue is not well understood under hypoxia exercise and normoxia exercise conditions. We performed RNA sequence analysis of mRNA isolated from epididymal adipose tissue and gastrocnemius muscle tissue in obese rats. The data contained changes in four different states: normoxic quiet, normoxic exercise, hypoxic quiet, and hypoxic exercise. RNA-seq data will provide insights into the cross-talk between muscle and fat, and the mechanisms of fat metabolism. The data of this study have not been published and are hereby published on this platform to study the cross talk between muscle tissue and adipose tissue in rats under different oxygen content and exercise environment.	menopause adipose RNA-seq
GEO (GDS)	GSE28660	GSE28660	GPL2895	Homo sapiens	12	low	Differential gene expression in uterosacral ligament from patients with recurrent and primary pelvic organ prolapse	Objective: The objective of this study was to profile differential gene expression in three distinct patient groups. Study Design: The groups consisted of women with recurrent POP, women with primary POP and women without POP. Whole human genome DNA microarrays were used to evaluate differential gene expression in uterosacral ligament (USL) tissues. Results: 10 genes of interest were identified in USL. Eight genes were over expressed 30-fold or greater, and two genes were under expressed. Confirmation of differential gene expression used the technique of real-time RT-PCR. Five of the substantially over expressed genes functioned in the distribution, metabolism or deposition of adipose tissue. Homeobox genes D10 and D11 were under expressed. Conclusions: The differential gene expression seen in the USL tissues in women with recurrent POP suggests that USLs are weakened by changes directed by these genes.	""postmenopausal"" adipose expression profiling
GEO (GDS)	GSE64692	GSE64692	GPL15084	Rattus norvegicus	6	low	Gene expression profiles of hexadecyl-4-124I-iodobenzoate(124I-HIB)-labeled adipose-derived stem cells (ADSCs) in vitro and in vivo	[1] Microarray analysis in the rat myocardial tissue: 124I-HIB transplanted MI model Vs. phosphate buffered saline (PBS) injected myocardial infarction (MI) model Vs. Sham operated model [2] Microarray analysis in the rat adipose derived stem cells: 124I-HIB-labeled ADSCs Vs. Unlabeled ADSCs	menopause adipose microarray
GEO (GDS)	GSE138512	GSE138512	GPL23227	Homo sapiens	4	low	Next Generation Sequencing Facilitates Quantitative Analysis of LAP2α deficient cells and control cells	Purpose: The goals of this study are to compare the mRNA profiles of LAP2α deficient human adipose-derived stem cells (hASCs) with that of control hASCs by NGS-derived RNA-seq to screen differentially expressed genes and possible involved pathways. Methods: Total RNA was isolated from hASCs transfected with shLAP2α and shNC. RNA sequencing of control and LAP2α deficient cells (each with 2 biological replicates) was performed using BGISEQ-500 sequencing system. Differentially expressed genes (DEGs) between control and LAP2α deficient cells were screened using NOISeq method. KEGG pathway enrichment analysis and Gene Ontology analysis of DEGs were subsequently conducted. Results: Using an optimized data analysis workflow, we mapped about 30 million sequence reads per sample to the cell genome. The scatterplot showed that depletion of LAP2α resulted in the upregulation of 106 genes and downregulation of 91 genes. KEGG pathway analysis suggested that LAP2α knockdown led to the change of several important pathways, including cell cycle, MAPK, and NF-κB signaling pathways that are critically related to cell growth and differentiation. Conclusions: Our results show that NGS offers a comprehensive and more accurate quantitative and qualitative evaluation of mRNA content within a cell or tissue.	menopause adipose RNA-seq
GEO (GDS)	GSE43471	GSE43471	GPL6947	Homo sapiens	96	high	Gene expression changes in adipose tissue with diet- and/or exercise-induced weight loss	An ancillary study within a randomized trial of diet, exercise, or combined diet+exercise vs. control among overweight/obese postmenopausal women. Subcutaneous adipose-tissue biopsies were performed at baseline and after 6 months and changes in adipose-tissue gene expression were determined by microarray with an emphasis on pre-specified candidate pathways, as well as by unsupervised clustering. Analyses were conducted first by randomization group, and then by degree of weight change at 6-months in all women combined.	""postmenopausal"" ""subcutaneous adipose""
GEO (GDS)	GSE66159	GSE66159	GPL570	Homo sapiens	76	high	Biomarkers of dietary energy restriction in women at increased risk of breast cancer	Dietary energy restriction (DER) reduces risk of spontaneous mammary cancer in rodents. In humans, DER in premenopausal years seems to reduce risk of postmenopausal breast cancer. Markers of DER are required to develop acceptable DER regimens for breast cancer prevention. We therefore examined markers of DER in the breast, adipose tissue, and serum. Nineteen overweight or obese women at moderately increased risk of breast cancer (lifetime risk, 1 in 6 to 1 in 3) ages between 35 and 45 were randomly allocated to DER [liquid diet, 3,656 kJ/d (864 kcal/d); n = 10] or asked to continue their normal eating patterns (n = 9) for one menstrual cycle. Biopsies of the breast and abdominal fat were taken before and after the intervention. RNA was extracted from whole tissues and breast epithelium (by laser capture microdissection) and hybridized to Affymetrix GeneChips. Longitudinal plasma and urine samples were collected before and after intervention, and metabolic profiles were generated using gas chromatography-mass spectrometry. DER was associated with significant reductions in weight [-7.0 (+/-2.3) kg] and in alterations of serum biomarkers of breast cancer risk (insulin, leptin, total and low-density lipoprotein cholesterol, and triglycerides). In both abdominal and breast tissues, as well as isolated breast epithelial cells, genes involved in glycolytic and lipid synthesis pathways (including stearoyl-CoA desaturase, fatty acid desaturase, and aldolase C) were significantly down-regulated. We conclude that reduced expressions of genes in the lipid metabolism and glycolytic pathways are detectable in breast tissue following DER, and these may represent targets for DER mimetics as effective chemoprophylactic agents Transcriptomic and Metabolomic intervention study of continuous energy restriction in 19 participants	""premenopausal"" ""postmenopausal"" adipose
GEO (GDS)	GSE262347	GSE262347	GPL13112	Mus musculus	18	high	Effect of lentiviral silencing of Rcor2 in MC3T3-E1 cells during osteoblast differentiation	Epigenetic regulation of bone formation is a complex network of active proteins and their cofactors. Recent developments in calcified tissue research have revealed several important pathways of epigenetic regulation leading to transcriptional changes in bone cells. Rest Corepressor 2 (Rcor2) is a coregulator of Lysine-specific histone demethylase 1 (Lsd1), a demethylase linked to osteoblast activity, hematopoietic stem cell differentiation and malignancy of different neoplasms. However, the role of Rcor2 in osteoblast differentiation has not yet been examined in detail. We have previously shown that Rcor2 is highly expressed in mesenchymal stromal cells (MSC) and particularly in the osteoblastic lineage. The role of Rcor2 in osteoblastic differentiation in vitro was further characterized and we demonstrate here that lentiviral silencing of Rcor2 in MC3T3-E1 cells led to a decrease in osteoblast differentiation, as shown by decreased alkaline phosphatase and von Kossa stainings as well as by decreased expression of several osteoblast-related marker genes. RNA-sequencing of the Rcor2-downregulated MC3T3-E1 cells revealed decreased repression of Rcor2 target genes, as well as significant upregulation of majority of the differentially expressed genes. While the heterozygous, global loss of Rcor2 in vivo did not lead to a detectable bone phenotype, conditional deletion of Rcor2 in limb-bud mesenchymal cells led to a moderate decrease in cortical bone volume, which was not accentuated by challenging bone formation by ovariectomy or tibial fracture. Furthermore, a global deletion of Rcor2 led to decreased amount of white adipose tissue in vivo and decreased the capacity of primary cells to differentiate into adipocytes in vitro, while the conditional deletion led to decreased adiposity in fracture calluses. Taken together, these results suggest that epigenetic regulation of mesenchymal stromal cell differentiation is mediated by Rcor2, which could thus play an important role in defining the MSC fate.	ovariectomy adipose gene expression
GEO (GDS)	GSE296580	GSE296580	GPL24247	Mus musculus	16	high	GDF15 Expression in Thermogenic Adipocytes Regulates Energy Homeostasis in a Sex-dependent Manner	Diet-induced obesity (DIO) induces growth differentiation factor 15 (GDF15) in various tissues, leading to increased GDF15 serum levels. The liver is the primary source of circulating GDF15 during DIO, but other tissues are also required. We investigated whether brown adipose tissue (BAT) contributes to GDF15 circulating levels and whether Gdf15 induction in BAT regulates systemic metabolism during DIO. We generated mice with selective Gdf15 deletion in thermogenic adipocytes (KO) and subjected them to 12 weeks of high-fat diet (HFD) feeding. Although in ad-libitum fed conditions GDF15 serum levels were unchanged between genotypes regardless of sex, female KO mice demonstrated reduced food intake, increased mitochondrial fatty acid oxidation in BAT, and were resistant to DIO, which was prevented by ovariectomy. Conversely, male KO mice demonstrated increased food intake, reduced mitochondrial respiratory capacity, and increased fibro-inflammation in BAT, resulting in increased body weight and fat mass accrual. Together, our data show that Gdf15 expression in BAT is required to regulate energy metabolism in mice in a sex-dependent manner.	ovariectomy adipose gene expression
GEO (GDS)	GSE194075	GSE194075	GPL24247	Mus musculus	15	high	High Fat Diet (HFD)-Induced Obesity Augments the Deleterious Effects of Estrogen Deficiency on Bone: Evidence from ovariectomized Mice.	There is an increasing clinical evidence that obesity exerts deleterious effects on the skeleton. While obesity coexists with estrogen deficiency in postmenopausal women, their combined effects on the skeleton are poorly studied. Thus, we investigated the impact of high-fat diet (HFD) on bone and metabolism of ovariectomized (OVX) female mice (C57BL/6J). OVX or sham operated mice were fed either HFD (60%fat) or normal diet (ND) (10%fat) for 12 weeks. HFD-OVX group exhibited pronounced increase in body weight (~86% in HFD and ~122% in HFD-OVX, p<0.0005) and impaired glucose tolerance. Bone microCT-scanning revealed a pronounced decrease in trabecular bone volume/total volume (BV/TV) in HFD-OVX (­15.6±0.48% in HFD and ­37.5±0.235% in HFD-OVX, p<0.005) and expansion of bone marrow adipose tissue (BMAT) (+60.7±9.9% in HFD vs +79.5±5.86% in HFD-OVX, p<0.005). Mechanistically, HFD-OVX treatment led to upregulation of genes markers of senescence, bone resorption, adipogenesis and inflammation and downregulation of gene markers of bone formation and bone development. Similarly, HFD- OVX treatment resulted in significant changes in bone tissue levels of Purine/Pyrimidine and Glutamate metabolisms, known to play a regulatory role in bone metabolism. Obesity and estrogen deficiency exert combined deleterious effects on bone resulting in accelerated cellular senescence, expansion of BMAT and impaired bone formation leading to decreased bone mass. Our results suggest that obesity may increase bone fragility in post-menopausal women.	menopause adipose RNA-seq
GEO (GDS)	GSE44000	GSE44000	GPL6480	Homo sapiens	14	high	Transcriptome profile of subcutaneous adipocytes isolated from obese vs. lean postmenopausal women	Adipocytes isolated from lean and obese postmenopausal women with no significant differences in metabolic syndrome parameters demonstrate changes in multiple inflammatory, metabolic and structural gene families.	""postmenopausal"" ""subcutaneous adipose""
GEO (GDS)	GSE263849	GSE263849	GPL24247	Mus musculus	8	high	Aromatase in adipose tissue exerts osteoprotective function in male mice via phosphorus regulation	Aromatase contributes to the maintenance of bone mass because male patients with loss-of-function mutations of CYP19A1 exhibit bone loss. Furthermore, treatment with aromatase inhibitor also causes bone loss in men as well as post-menopausal women, in whom serum estrogen level is very low, suggesting that a part of the anabolic effects of testosterone in men is dependent on estradiol (E2) biosynthesized by aromatase in non-gonadal tissues. However, it remains unclear how locally biosynthesized E2 contributes to the maintenance of bone mass. We examined the function of aromatase in local tissues rather than gonad using cell type specific aromatase KO mice. Because osteoblast-specific aromatase KO mice exhibited no bone phenotype, we focused on adipose tissue, which is known as reservoir of steroid hormones, and analyzed the bone phenotypes of adipose tissue-specific aromatase KO mice (AroΔaP2). Sixteen-week-old male AroΔaP2 mice exhibit significantly lower bone mineral density in tibia and femur, especially in trabecular bone compared to the control. Bone histomorphometry showed that AroΔaP2 mice exhibited an osteomalacia-like bone phenotype with increased osteoid volume and width, and decreased osteoclast area and numbers. Moreover, serum PI and renal phosphorus reabsorption were significantly decreased but FGF23 level was decreased in AroΔaP2, suggesting that an osteomalacia-like phenotype in AroΔaP2 was not caused by abnormal FGF23 level. Finally, we analyzed NaPi2a and NaPi2c, a phosphate transporter localized in the kidney, and found that protein levels in renal brush border membrane vesicles were decreased in AroΔaP2. These results indicate that locally biosynthesized estrogens by aromatase in adipocytes can play a significant role in bone mass maintenance via regulate phosphorus reabsorption in kidney by NaPi2.	menopause adipose RNA-seq
GEO (GDS)	GSE268528	GSE268528	GPL24247	Mus musculus	8	high	Ablation of hematopoietic stem cell derived adipocytes reduces tumor burden in a syngeneic mouse model of high grade serous carcinoma	Introduction: The purpose of this study is to examine the influence of hematopoietic stem cell derived adipocytes (HSCDAs) on the proliferation and metastasis of high-grade serous carcinoma (HGSC), the most common and aggressive type of ovarian cancer. HSCDAs begin as myeloid cells that traffic to adipose tissue and differentiate a highly inflammatory subtype of adipocytes. HSCDAs accumulate within visceral adipose depots. HSCDA production is increased in ovariectomized mice, suggesting that HSCDAs are likely to extensively accrue in postmenopausal patients. We hypothesize that HSCDAs promote HGSC progression and establish a pro-tumoral niche within peritoneal adipose tissues such as the omentum. Methods: We sorted and differentiated primary human adipocyte precursors into HSCDAs and CMAs and examined cytokine secretion in adipocyte conditioned media by ELISA. We incubated human HGSC cells (PEO1, OVCAR4, and OVCAR8) in conditioned media and assayed proliferation. We incubated conditioned media on PEO1 ovarian cancer cells and analyzed protein expression and phosphorylation by reverse phase protein array (RPPA). Finally, we implanted mouse ID8 HGSC cells into syngeneic HSCDA Deficient (experimental) and Proficient (control) mice. We compared tumor size and intraperitoneal spread. We also measured the adipokine milieu of ascites fluid by ELISA, tumor transcription by RNA-Seq, and immune infiltration by IHC. Results: HSCDA cells secreted elevated amounts of IL-6 and IL-8. In proliferation assays, HGSC lines showed varying growth rates in HSCDA or CMA media. RPPA showed that PEO1 cells incubated in HSCDA media upregulated markers of epithelial to mesenchymal plasticity (EMP) and pro-survival phosphoprotein signaling. Conversely, PEO1 cells in HSCDA media downregulated multiple tumor suppressors. Finally, we observed that ablation of HSCDAs in mice reduced tumor burden. RNA-Seq of bulk omentum tumor from HSCDA Deficient mice had higher TLR and IFN signaling, and lower fatty acid oxidation pathway expression than Proficient mice. Densities of dendritic cells (DC) and natural killer (NK) cells was reduced in tumors in HSCDA Deficient mice, and spatial analysis showed fewer DCs, NKs, and B-cells near tumor cells in HSCDA Deficient mice. Conclusion: Our data suggest that HSCDAs can promote HGSC survival and plasticity while downregulating tumor suppressors, and also may alter the peritoneal adipose immune and metabolic environment to promote HGSC progression.	""postmenopausal"" ""visceral adipose""
